{"acceptance":"accepted_input","assumption_note":"U2-U0003-acceptance-v1: new npu-l4 nominal efficiency 1.0, explicitly unvalidated; not a hardware fact, fallback or fitted value. Retained upstream 0.55 is unchanged.","compute":{"date":null,"kind":"claim","provenance":"stub","rationale":null,"source":null,"unit":"ratio","value":1.0},"evidence_hashes":[],"execution_model_hash":"sha256:6121a0636cb009c9cddf0fbd9fe945745ea50c666b57e072abc7e5ab71c6c2c6","format":"uarch-execution-model/1","kind":"scalar_efficiency","memory":null}
